3,Chilblains,You've been frigid one too many times and your skin easily develops a rash and blisters in cold. You havedisadvantage to Constitution checks and saving throws made to resist the environmental effects of cold.,5,ExtensiveFrostbite,"Roll twice on the Small Appendage Table. These appendages are firm, frigid, pale, and nonfunctional. If nottreated within 15 minutes they will necrotize and fall off in 1d4 days (after which they are missing).Treatment - A short rest slowly rewarming the appendages.",7,The Shivers,You are so cold your hands are shaking uncontrollably and your voice quavers as you speak. The next threespells you cast have a 50% chance to fail. This effect ends after three spells are attempted.,9,Frozen inPlace,"You attempt to move your feet but find the intensity of the cold has frozen you directly to the ground.You are restrained. If you are flying or otherwise not contacting a surface, there is no effect.Treatment - A Strength check (DC equals half the damage that caused the lingering injury or 10,whichever number is higher) as an action allows you to break free.",11,Pale BlueDot,"Roll on the Scar Chart. This body area is left with a pale, blue-tinged scar.",13,Frost NippedToes,You cannot take the dash action. This effect lasts 1d6 rounds.,15,Heart of Ice,"Roll on the Scar Chart. In a freak instance of chance, the cold has interacted with a thread of natural magicwithin you. This area of your body is permanently frigid (though to you it feels pleasantly cool) and itradiates a faint aura of Transmutation. You have advantage on Constitution checks and saves made toresist the environmental effects of cold. You may supress this effect by maintaining concentration.",17,Frost BittenLimb,"Roll on the Large Limb Table. Your limb is frozen, rigid, numb, and nonfunctional. If not treated within 15minutes the limb will necrotize and fall off in 1d4 days (after which it is missing).Treatment - A short rest slowly rewarming the limb."
